{"candidateFingerprint":"1226a4fdd459cedfcd91ab9e942a3c3a753c32f67ccb991cf0fcd5787ba68ae2","candidateId":"TWIN_HUB_CONVERGENCE_v0","chainAudit":{"perTier":{"D4":14,"D5":14},"rows":[{"auditTier":"D4","contactTier":"A1","dAnchorMask":1831,"dAnchorOffice":"Jupiter","edgeId":"seat-contact:D4:1831:1703:0","parentMask":1707,"reason":"ok","satelliteMask":1703,"satelliteTier":"A1","valid":true},{"auditTier":"D4","contactTier":"A1","dAnchorMask":1831,"dAnchorOffice":"Jupiter","edgeId":"seat-contact:D4:1831:1835:0","parentMask":1707,"reason":"ok","satelliteMask":1835,"satelliteTier":"A1","valid":true},{"auditTier":"D4","contactTier":"A1","dAnchorMask":2363,"dAnchorOffice":"Sun","edgeId":"seat-contact:D4:2363:1339:0","parentMask":1371,"reason":"ok","satelliteMask":1339,"satelliteTier":"A1","valid":true},{"auditTier":"D4","contactTier":"A1","dAnchorMask":2363,"dAnchorOffice":"Sun","edgeId":"seat-contact:D4:2363:2395:0","parentMask":1371,"reason":"ok","satelliteMask":2395,"satelliteTier":"A1","valid":true},{"auditTier":"D4","contactTier":"A1","dAnchorMask":2963,"dAnchorOffice":"Saturn","edgeId":"seat-contact:D4:2963:2899:0","parentMask":2901,"reason":"ok","satelliteMask":2899,"satelliteTier":"A1","valid":true},{"auditTier":"D4","contactTier":"A1","dAnchorMask":2963,"dAnchorOffice":"Saturn","edgeId":"seat-contact:D4:2963:2965:0","parentMask":2901,"reason":"ok","satelliteMask":2965,"satelliteTier":"A1","valid":true},{"auditTier":"D4","contactTier":"A1","dAnchorMask":3229,"dAnchorOffice":"Mars","edgeId":"seat-contact:D4:3229:2717:0","parentMask":2733,"reason":"ok","satelliteMask":2717,"satelliteTier":"A1","valid":true},{"auditTier":"D4","contactTier":"A1","dAnchorMask":3229,"dAnchorOffice":"Mars","edgeId":"seat-contact:D4:3229:3245:0","parentMask":2733,"reason":"ok","satelliteMask":3245,"satelliteTier":"A1","valid":true},{"auditTier":"D4","contactTier":"A1","dAnchorMask":3529,"dAnchorOffice":"Moon","edgeId":"seat-contact:D4:3529:1765:1","parentMask":1749,"reason":"ok","satelliteMask":1765,"satelliteTier":"A1","valid":true},{"auditTier":"D4","contactTier":"A1","dAnchorMask":3529,"dAnchorOffice":"Moon","edgeId":"seat-contact:D4:3529:3497:0","parentMask":1749,"reason":"ok","satelliteMask":3497,"satelliteTier":"A1","valid":true},{"auditTier":"D4","contactTier":"A1","dAnchorMask":631,"dAnchorOffice":"Venus","edgeId":"seat-contact:D4:631:1261:-1","parentMask":1389,"reason":"ok","satelliteMask":1261,"satelliteTier":"A1","valid":true},{"auditTier":"D4","contactTier":"A1","dAnchorMask":631,"dAnchorOffice":"Venus","edgeId":"seat-contact:D4:631:695:0","parentMask":1389,"reason":"ok","satelliteMask":695,"satelliteTier":"A1","valid":true},{"auditTier":"D4","contactTier":"A1","dAnchorMask":953,"dAnchorOffice":"Mercury","edgeId":"seat-contact:D4:953:1465:0","parentMask":1461,"reason":"ok","satelliteMask":1465,"satelliteTier":"A1","valid":true},{"auditTier":"D4","contactTier":"A1","dAnchorMask":953,"dAnchorOffice":"Mercury","edgeId":"seat-contact:D4:953:949:0","parentMask":1461,"reason":"ok","satelliteMask":949,"satelliteTier":"A1","valid":true},{"auditTier":"D5","contactTier":"A2","dAnchorMask":1273,"dAnchorOffice":"Jupiter","edgeId":"seat-contact:D5:1273:1269:0","parentMask":1397,"reason":"ok","satelliteMask":1269,"satelliteTier":"A2","valid":true},{"auditTier":"D5","contactTier":"A2","dAnchorMask":1273,"dAnchorOffice":"Jupiter","edgeId":"seat-contact:D5:1273:1401:0","parentMask":1397,"reason":"ok","satelliteMask":1401,"satelliteTier":"A2","valid":true},{"auditTier":"D5","contactTier":"A2","dAnchorMask":2383,"dAnchorOffice":"Moon","edgeId":"seat-contact:D5:2383:1359:0","parentMask":1367,"reason":"ok","satelliteMask":1359,"satelliteTier":"A2","valid":true},{"auditTier":"D5","contactTier":"A2","dAnchorMask":2383,"dAnchorOffice":"Moon","edgeId":"seat-contact:D5:2383:2391:0","parentMask":1367,"reason":"ok","satelliteMask":2391,"satelliteTier":"A2","valid":true},{"auditTier":"D5","contactTier":"A2","dAnchorMask":3239,"dAnchorOffice":"Mercury","edgeId":"seat-contact:D5:3239:2727:0","parentMask":2731,"reason":"ok","satelliteMask":2727,"satelliteTier":"A2","valid":true},{"auditTier":"D5","contactTier":"A2","dAnchorMask":3239,"dAnchorOffice":"Mercury","edgeId":"seat-contact:D5:3239:3243:0","parentMask":2731,"reason":"ok","satelliteMask":3243,"satelliteTier":"A2","valid":true},{"auditTier":"D5","contactTier":"A2","dAnchorMask":3667,"dAnchorOffice":"Venus","edgeId":"seat-contact:D5:3667:3411:0","parentMask":3413,"reason":"ok","satelliteMask":3411,"satelliteTier":"A2","valid":true},{"auditTier":"D5","contactTier":"A2","dAnchorMask":3667,"dAnchorOffice":"Venus","edgeId":"seat-contact:D5:3667:3669:0","parentMask":3413,"reason":"ok","satelliteMask":3669,"satelliteTier":"A2","valid":true},{"auditTier":"D5","contactTier":"A2","dAnchorMask":3881,"dAnchorOffice":"Sun","edgeId":"seat-contact:D5:3881:1941:1","parentMask":1877,"reason":"ok","satelliteMask":1941,"satelliteTier":"A2","valid":true},{"auditTier":"D5","contactTier":"A2","dAnchorMask":3881,"dAnchorOffice":"Sun","edgeId":"seat-contact:D5:3881:3753:0","parentMask":1877,"reason":"ok","satelliteMask":3753,"satelliteTier":"A2","valid":true},{"auditTier":"D5","contactTier":"A2","dAnchorMask":671,"dAnchorOffice":"Saturn","edgeId":"seat-contact:D5:671:1341:-1","parentMask":1373,"reason":"ok","satelliteMask":1341,"satelliteTier":"A2","valid":true},{"auditTier":"D5","contactTier":"A2","dAnchorMask":671,"dAnchorOffice":"Saturn","edgeId":"seat-contact:D5:671:687:0","parentMask":1373,"reason":"ok","satelliteMask":687,"satelliteTier":"A2","valid":true},{"auditTier":"D5","contactTier":"A2","dAnchorMask":997,"dAnchorOffice":"Mars","edgeId":"seat-contact:D5:997:1509:0","parentMask":1493,"reason":"ok","satelliteMask":1509,"satelliteTier":"A2","valid":true},{"auditTier":"D5","contactTier":"A2","dAnchorMask":997,"dAnchorOffice":"Mars","edgeId":"seat-contact:D5:997:981:0","parentMask":1493,"reason":"ok","satelliteMask":981,"satelliteTier":"A2","valid":true}],"total":28,"twoContactsPerAnchor":true,"validCount":28,"violations":[]},"d4Case":{"chainValid":true,"claim":"convergence-through-twins","family":"7-Z17","hub":null,"hubDefined":false,"midpointSeamAnchors":[1371,2901],"midpoints":["Saturn","Sun"],"pairOffices":[["Moon","Saturn"],["Sun","Venus"]],"pairsDisjoint":true,"seamsSeated":true,"seatContactRows":14,"summary":"A1-generating twin pairs are disjoint (no hub) and their midpoints {Sun, Saturn} are seated as A1 phase seams; all 14 D4 seat-contact rows route the permitted single-hop chain.","tier":"D4","twinPairs":[{"forte":"7-35","hamming":10,"leftMask":2773,"leftName":"Lydian","leftOffice":"Sun","rightMask":1451,"rightName":"Phrygian","rightOffice":"Venus"},{"forte":"7-35","hamming":10,"leftMask":2741,"leftName":"Ionian","leftOffice":"Moon","rightMask":1387,"rightName":"Locrian","rightOffice":"Saturn"}],"verified":true},"d5Case":{"a3Absent":true,"chainValid":true,"claim":"convergence-onto-unseated-midpoints","family":"7-Z12","hub":"Mercury","hubDefined":true,"hubIsMercury":true,"midpointAnchorProvenance":{"Jupiter":["exact midpoint construction","exact midpoint construction"],"Mars":["exact midpoint construction","exact midpoint construction"]},"midpoints":["Jupiter","Mars"],"midpointsUnseatedAsSeams":true,"pairOffices":[["Mercury","Venus"],["Moon","Mercury"]],"seatContactRows":14,"seatsUnseatedMidpointOffices":true,"summary":"A2 twin pairs share the Mercury hub; their ring midpoints {Mars, Jupiter} are unseated as seams (exact midpoints, no A3); all 14 D5 seat-contact rows route the permitted single-hop chain, seating the unseated-midpoint offices.","tier":"D5","twinPairs":[{"forte":"7-33","hamming":10,"leftMask":1367,"leftName":"Leading Whole-Tone Inverse","leftOffice":"Moon","rightMask":2731,"rightName":"Neapolitan Major","rightOffice":"Mercury"},{"forte":"7-33","hamming":10,"leftMask":2731,"leftName":"Neapolitan Major","leftOffice":"Mercury","rightMask":3413,"rightName":"Leading Whole-Tone","rightOffice":"Venus"}],"verified":true},"evidenceBindings":{"canonicalLedgerSha256":"e6570972260fdae5c4ca878272dc89a9ff353d48762eefbe019707d229cd242d","decisionLedgerSha256":"e134988b3e5a03b37a8a8fef76fdff997f5aa40f65c6249e2e8544458e99f137","networkFingerprint":"21e2a632837ecf40fe9229e9eb4ec0a5cceb9e2043fe89cb8e1d320518d7bdbc","observationLedgerSha256":"8e0be9f5bcee0af1aeb87b8ee71fa18121376c1e2b8e23416439c8834e17787f"},"generatedAt":"2026-10-13T00:00:00.000Z","generator":"scripts/generate-twin-hub-convergence.py","generatorDigest":"892f50b4a3d3b7a45ef0f76d970650c1538cac04d6dabd2c2ef4d0fa1ea79bb4","invocation":["python3","scripts/generate-twin-hub-convergence.py"],"method":{"hub":"the office appearing in both twin pairs of a tier; may be undefined (A1 pairs {Moon,Saturn}/{Sun,Venus} are disjoint); undefinedness constitutes the D4/D5 asymmetry","maskConvention":"12-bit pitch-class mask; bit i = pitch class i; root normalized to pitch class 0","permittedChain":"D-anchor <- SEAT_CONTACT <- satellite <- GOVERNS <- parent anchor (single hop, satellite tier = parent tier)","ringMidpoint":"for a distance-2 office pair {k-1,k+1}, office k is the unique vertex adjacent to both on the office ring","rootPhase":"adjacent-root displacement +/-1 with renormalization; CONSTRUCTS phase-seam edges carry mode=root_phase","t1Receipt":"T1(Ionian)=Locrian; near-match rejected","t1Twin":"two root-0 states of the same Forte family with m(B)=T+/-1(m(A)) under the declared 12-bit mask convention (transpose_mask, src/governor/shadow_ladder.py), joined by a root_phase edge","verdictSemantics":"confirmed when the receipt, both D4/D5 cases, and all 28 chains verify; partial when only some do; refuted otherwise. All three close the story."},"negativeControls":[{"claim":"the dH10 same-family root-0 pair {Locrian 1387, Lydian 2773} is not accepted as a T1 twin (m(B) != T+/-1(m(A)))","expected":true,"id":"near-match-rejected","value":true},{"claim":"1387 and 2773 are both root-0 7-35 modes at dH10 (a real near-match, not a straw man)","expected":true,"id":"